{
  "record_id": "sha256:6f1c0b2ad3e4c5f60718293a4b5c6d7e8f90a1b2c3d4e5f60718293a4b5c6d7e",
  "release": { "id": "4.2.0", "baseline_id": "4.1.3", "created_at": "2026-09-28T02:14:00Z" },
  "test": {
    "id": "func.polybag_pick.v7",
    "family": "functional",
    "task": "polybag picking, loose fill",
    "spec_version": "7",
    "tolerance": { "metric": "success_rate", "max_regression": 2.0, "unit": "percentage_points" }
  },
  "runner": { "kind": "calibrated_sim", "engine": "genesis", "engine_version": "1.4.0", "episodes": 860 },
  "system_under_test": {
    "hardware": { "platform": "arm-6dof-a", "end_effector": "suction-4cup-40mm", "degradation_index": 0.41, "hours_since_service": 380 },
    "policy": {
      "checkpoint_id": "ckpt-0419",
      "weights_sha256": "9a3f7c1e5b82d40f6e9c8b7a5d4e3f2c1b0a9f8e7d6c5b4a39281706f5e4d3c2",
      "architecture": "vla-2b",
      "training_data_provenance_class": "mixed"
    },
    "stack": { "firmware_version": "2.9.1", "sbom_ref": "sbom/4.2.0.cdx.json" },
    "site": { "site_id": "site-07", "cell_id": "induction-3", "item_catalogue_version": "2026-09" }
  },
  "outcome": {
    "metric": "success_rate",
    "value": 87.6,
    "baseline_value": 88.2,
    "delta": -0.6,
    "ci95": [86.1, 89.0],
    "n": 860
  },
  "fidelity": {
    "rho": 0.84,
    "method": "spearman_vs_real",
    "checkpoints_used": 11,
    "max_rank_violation": 0.03,
    "gating_authority": "gating"
  },
  "provenance": {
    "created_at": "2026-09-28T04:02:11Z",
    "created_by": "svc://gate-runner",
    "seed": 20260928,
    "inputs_digest": "sha256:11aa22bb33cc44dd55ee66ff77008899aabbccddeeff00112233445566778899",
    "code_ref": "git:0f4c1de",
    "immutable": true
  }
}
